{
  "request_id": "11111111-1111-4111-8111-111111111112",
  "correlation_id": "22222222-2222-4222-8222-222222222223",
  "tenant_id": "33333333-3333-4333-8333-333333333333",
  "query_type": "ResolveCurrentParty",
  "schema_version": "1.0.0",
  "data_classification": "Restricted",
  "error": {
    "code": "MAPPING_NOT_FOUND",
    "category": "RESOURCE_NOT_FOUND",
    "message": "No active mapping is available for the tenant-scoped source identity.",
    "retryable": false,
    "support_reference": "support-20260731-absent"
  }
}
